id_original,texto_limpio,etiqueta_original,prediccion_svm
360,prisionero infeliz donde no expira aura suave ni apacible viento mis penas lloro mis desdichas siento que hiere un mal cuando otro se retira pajaro asi que en libertad se mira solo a su voz y a la del aire atento lamenta la prision gime al tormento cuando el perdido bien preso suspira rigor fue de torturas que previno tirana siempre de mi amor al fuego inhumana crueldad barbaros lazos oh rapaz tu en victoria peregrino por que permites pues te sigo ciego cadena injusta a mis amantes brazos,Amoroso,Amoroso
152,amar quiero sin premio y nunca puedo que amar es premio padecer querria y el dolor tanto agrada al alma mia que de este gusto escrupuloso quedo apetezco morir y en el denuedo hallo nueva razon de cobardia que huyo del mal y toma la osadia la parte del vivir la voz del miedo si vivo mi dolor desacredito si muero y amo el alma lo condena que uno es comodidad y otro delito oh novedad de mas desdicha ajena que vida sobre a un mal que es infinito y no baste el morir para una pena,Amoroso,Melancolico
203,el triste fin la suerte infortunada ajeno premio de la fe constante del uno y otro miserable amante a quien perdio una noche y una espada encierra en sobre oscura esta labrada piedra tu peregrino caminante repara el grave caso y con semblante pio suspende el curso a tu jornada que daras tiernas lagrimas no dudo a las cenizas donde aun dura ardiente el fuego que causo desdicha tanta debida compasion al mal que pudo trocar color en la cercana fuente y el de su fruto en la silvestre planta,Religioso Mistico,Melancolico
41,hoy queda para siempre declarado vaga espaciosa fertil y agradable que es el fruto que das inestimable puro precioso rico y regalado pues le ofreces a todos sazonado util al alma y a la vista amable con una erudicion incomparable y en estilo jamas imaginado no solo es digno de que ganes nombre y le gane madrid cual madre tuya honrada de tenerte por su hijo mas de que el tajo nueva envidia asombre de que al betis la gloria se atribuya de hallar mecenas en don juan de arguijo,Religioso Mistico,Religioso Mistico
163,como me viese amor desnudo y tierno temblando el triste va buscando un dia donde escaparse de la nieve fria y el hielo mitigar del recio invierno mas como vido el resplandor eterno que de la hermosa fili alli se via lumbre debe de haber aqui decia y entrando busca a su dolor gobierno toco en el seno el nino y diole enojos que estaba frio mas que nieve el seno y el corazon que es piedra mal le trata huyo del corazon fuese a los ojos y como vio lugar tan dulce y bueno alli quiso vivir y de alli mata,Amoroso,Amoroso
437,este postumo honor del ya segundo si primo apolo no pompa altanera dice la que hoy dejo noche postrera a las musas sin luz sin sol al mundo extinto aclama al heroe mas fecundo oraculo espanol a quien venera espana muerto y de quien muerto espera de tanta vega fruto bien fecundo admira o peregrino o tu que errante espectaculos buscas tanta gloria fin tan lloroso a mente tan lucida contempla de esta pira lo elegante y erige eterno templo en la memoria al que a las penas con su voz dio vida,Heroico,Religioso Mistico
254,famoso nombre cordoba la llana recibe porque a seneca ha criado apuleyo a africa ha ensalzado no menos que a su traza soberana caton el sabio a la nacion romana inmensa gloria con su ciencia ha dado sinon su humilde patria ha levantado crisipo establecio la ley tebana homero a grecia puso en gran alteza cartago por creson fue ennoblecida apolo a delfos dio dichosa suerte si en estas caber vemos tal grandeza con cuanta mas razon engrandecida a de ser cartagena sabia y fuerte los cielos porque acierte en un poeta influyen arte y ciencia solo para que alabe su excelencia,Heroico,Religioso Mistico
262,si el sol se pone yo a la muerte llego quien detenerlo por vivir pudiera deten dorado apolo el carro espera mas el sol no se para a nuestro ruego oh tu senora por quien vivo ciego alza los claros ojos a la esfera y dile al sol que pare su carrera o no le prestaras la luz y el fuego que por solo mirar tu hermosura parara los caballos admirado y no vendra la noche de mi muerte mas ay triste de mi quien me asegura que de ver lo que excedes afrentado no les de rienda y huya por no verte,Melancolico,Amoroso
111,dulcisimo jesus mi amor festina festina que por verte peno y muero muero por ti y ansi mi amor lo quiero quierolo porque amor a esto me inclina incliname a decir mi amor camina camina mas que le gamo muy ligero ligero y sin tardarte porque espero espero que esperando amor se afina enfermo estoy de amor y muy sediento sediento como el siervo fatigado fatigado de amor tengo mi pecho mi pecho solo en verte esta contento contento no hay sin ti jesus amado amado con amor fuerte y estrecho,Amoroso,Amoroso
